{
  "$schema": "https://json-schema.org/draft/2020-12/schema",
  "$id": "https://github.com/stacknil/telemetry-lab/schemas/config_change_events.schema.json",
  "title": "Config-change normalized events",
  "description": "Schema for demos/config-change-investigation-demo/artifacts/change_events_normalized.json.",
  "type": "array",
  "minItems": 1,
  "items": {
    "type": "object",
    "additionalProperties": false,
    "required": [
      "change_id",
      "timestamp",
      "actor",
      "target_system",
      "config_key",
      "old_value",
      "new_value",
      "change_result",
      "change_ticket"
    ],
    "properties": {
      "change_id": { "type": "string", "minLength": 1 },
      "timestamp": { "type": "string", "format": "date-time" },
      "actor": { "type": "string", "minLength": 1 },
      "target_system": { "type": "string", "minLength": 1 },
      "config_key": { "type": "string", "minLength": 1 },
      "old_value": { "type": "string" },
      "new_value": { "type": "string" },
      "change_result": { "type": "string", "minLength": 1 },
      "change_ticket": { "type": "string", "minLength": 1 }
    }
  }
}
